{
  "schemaVersion": "1.0.0",
  "observedAt": "2026-10-13T15:20:00+09:00",
  "publishedAt": "2026-10-13T15:20:00+09:00",
  "staleAfterHours": 168,
  "source": {
    "kind": "operator-reviewed-snapshot",
    "snapshotId": "2026-10-13-public-v1",
    "evidenceClass": "reviewed-private-source",
    "note": "공개 검토된 제품 진행 snapshot이며 실시간 Worker 상태나 운영 권한을 제공하지 않습니다."
  },
  "workstreams": [
    {
      "id": "portal-publication",
      "priority": "P0",
      "overall": "active",
      "needsAction": true,
      "title": "Worker Portal 공개 배포",
      "code": "STATIC SITE · RELEASE CANDIDATE",
      "summary": "Worker 제품 로드맵과 단계별 완료 상태를 공개 가능한 정적 snapshot으로 제공하는 Portal입니다.",
      "planning": { "tone": "complete", "label": "범위 확정", "note": "read-only portal" },
      "design": { "tone": "complete", "label": "설계 완료", "note": "static architecture" },
      "development": { "tone": "complete", "label": "구현 완료", "note": "HTML · CSS · JS" },
      "validation": { "tone": "pass", "label": "로컬 통과", "note": "CI 별도 확인" },
      "release": { "tone": "pending", "label": "게시 대기", "note": "Pages workflow" },
      "runtime": { "tone": "pending", "label": "외부 검증 전", "note": "HTTPS acceptance" },
      "nextTitle": "GitHub Pages 배포",
      "nextText": "검증된 동일 artifact를 게시하고 외부 URL과 release identity를 확인합니다.",
      "evidence": ["public repository validation", "deterministic static artifact", "operator-reviewed data contract"],
      "risks": ["배포 전 소스 상태를 운영 상태로 표현하지 않음", "공개 snapshot에 내부 identity를 포함하지 않음"]
    },
    {
      "id": "portal-custom-domain",
      "priority": "P0",
      "overall": "blocked",
      "needsAction": true,
      "title": "Portal 사용자 도메인",
      "code": "DOMAIN · DEPLOYMENT GATE",
      "summary": "GitHub Pages 기본 URL 검증 후 승인된 DNS와 TLS 전환으로 Worker Portal 도메인을 연결합니다.",
      "planning": { "tone": "complete", "label": "절차 정의", "note": "rollback 포함" },
      "design": { "tone": "complete", "label": "경계 확정", "note": "Pages + DNS + TLS" },
      "development": { "tone": "pending", "label": "설정 전", "note": "DNS 변경 없음" },
      "validation": { "tone": "pending", "label": "사전조사", "note": "기존 값 보존" },
      "release": { "tone": "blocked", "label": "순서 대기", "note": "Pages 먼저" },
      "runtime": { "tone": "pending", "label": "미연결", "note": "외부 acceptance 전" },
      "nextTitle": "Pages 검증 후 도메인 전환",
      "nextText": "기존 레코드와 복구값을 보존하고 DNS, 인증서, HTTPS를 순서대로 확인합니다.",
      "evidence": ["documented domain transition plan", "custom-domain rollback contract"],
      "risks": ["DNS 변경과 Pages 설정이 불일치하면 접근 실패 가능", "TLS 발급 완료 전 HTTPS 강제를 활성화하지 않음"]
    },
    {
      "id": "worker-console-experience",
      "priority": "P1",
      "overall": "active",
      "needsAction": false,
      "title": "Worker Console 경험",
      "code": "PRODUCT UX · CONTROLLED ROLLOUT",
      "summary": "운영 상태와 작업 맥락을 명확히 보여 주는 Worker Console 경험을 단계적으로 개선합니다.",
      "planning": { "tone": "complete", "label": "원칙 정의", "note": "operator clarity" },
      "design": { "tone": "complete", "label": "기준 수립", "note": "responsive UI" },
      "development": { "tone": "complete", "label": "통합 진행", "note": "bounded features" },
      "validation": { "tone": "partial", "label": "부분 검증", "note": "feature evidence" },
      "release": { "tone": "partial", "label": "단계적 제공", "note": "controlled rollout" },
      "runtime": { "tone": "partial", "label": "범위별 확인", "note": "acceptance separate" },
      "nextTitle": "변경 기능별 acceptance",
      "nextText": "각 기능의 동작, 보존 데이터와 비대상 영향을 배포 범위별로 확인합니다.",
      "evidence": ["UX standard", "focused validation", "bounded release process"],
      "risks": ["화면 진입 성공을 전체 기능 acceptance로 해석하지 않음"]
    },
    {
      "id": "desktop-worker-distribution",
      "priority": "P1",
      "overall": "active",
      "needsAction": true,
      "title": "Desktop Worker 배포",
      "code": "DESIGN · SOURCE CANDIDATE",
      "summary": "여러 데스크톱 환경에서 일관된 Worker 경험을 제공하기 위한 설치, 업데이트와 복구 경계를 설계합니다.",
      "planning": { "tone": "complete", "label": "목표 정의", "note": "cross-platform" },
      "design": { "tone": "source", "label": "설계 검토", "note": "platform matrix" },
      "development": { "tone": "partial", "label": "기초 계약", "note": "source candidate" },
      "validation": { "tone": "partial", "label": "소스 검증", "note": "runtime 별도" },
      "release": { "tone": "pending", "label": "미출시", "note": "publisher decision" },
      "runtime": { "tone": "pending", "label": "미설치", "note": "named desktop 없음" },
      "nextTitle": "지원 Matrix와 release owner 결정",
      "nextText": "플랫폼 지원 범위와 서명·배포 책임을 확정한 뒤 staged validation을 시작합니다.",
      "evidence": ["desktop distribution design", "source contract validation"],
      "risks": ["플랫폼별 설치·업데이트 계약을 암묵적으로 동일시하지 않음"]
    },
    {
      "id": "secure-worker-collaboration",
      "priority": "P1",
      "overall": "active",
      "needsAction": false,
      "title": "승인형 Worker 협업",
      "code": "SECURE REQUEST · APPROVAL GATED",
      "summary": "사용자가 승인한 단일 요청을 독립적인 대상 정책과 감사 경계 안에서 전달하는 협업 기능입니다.",
      "planning": { "tone": "complete", "label": "범위 확정", "note": "one request" },
      "design": { "tone": "complete", "label": "보안 설계", "note": "authority separation" },
      "development": { "tone": "complete", "label": "기능 구현", "note": "bounded connector" },
      "validation": { "tone": "pass", "label": "제한 검증", "note": "duplicate prevention" },
      "release": { "tone": "partial", "label": "제한 제공", "note": "selected scope" },
      "runtime": { "tone": "partial", "label": "범위 제한", "note": "no fleet claim" },
      "nextTitle": "승인·감사 경계 유지",
      "nextText": "자동 확장 없이 사용자 승인과 대상별 독립 정책을 계속 검증합니다.",
      "evidence": ["approval-gated collaboration contract", "idempotency validation", "permission attenuation"],
      "risks": ["자동 후속 요청과 권한 위임은 지원하지 않음"]
    },
    {
      "id": "worker-public-profile",
      "priority": "P2",
      "overall": "active",
      "needsAction": false,
      "title": "Worker 공개 프로필",
      "code": "FIXED TEMPLATE · SOURCE ONLY",
      "summary": "Worker를 소개하는 공개 페이지를 고정된 필드와 검토·확인·복구 절차 안에서 제공합니다.",
      "planning": { "tone": "complete", "label": "필드 정의", "note": "fixed template" },
      "design": { "tone": "complete", "label": "경계 확정", "note": "no arbitrary code" },
      "development": { "tone": "complete", "label": "소스 구현", "note": "preview workflow" },
      "validation": { "tone": "pass", "label": "기능 검증", "note": "deployment separate" },
      "release": { "tone": "source", "label": "소스만", "note": "release pending" },
      "runtime": { "tone": "pending", "label": "미배포", "note": "acceptance 없음" },
      "nextTitle": "단일 대상 배포 검증",
      "nextText": "공개 콘텐츠, 보안 정책과 복구 동작을 staged 환경에서 확인합니다.",
      "evidence": ["fixed-template contract", "preview and rollback validation"],
      "risks": ["임의 HTML, JavaScript 또는 CMS 확장으로 해석하지 않음"]
    }
  ]
}
